{
  "description": "Repository binding, model and effort policy, and workflow lint config for this repository, which consumes its own packages. agenticool-agents generates and syncs the agent files from it, and agenticool-workflow-lint reads workflowLint.",
  "binding": {
    "namespace": "agenticool",
    "label": "Agenticool",
    "repository": "agenticool/agenticool",
    "project": {
      "owner": "agenticool",
      "ownerType": "organization",
      "number": 1,
      "name": "Agenticool delivery"
    },
    "tokenEnv": "AGENTICOOL_PROJECT_TOKEN",
    "docs": {
      "triage": "ISSUE_TRIAGE.md",
      "workflow": "AGENTS.md",
      "guides": ["AGENTS.md"]
    },
    "features": {
      "infrastructure": false,
      "releasePlease": true,
      "browserMcp": false
    }
  },
  "capabilities": {
    "issue-creation": {
      "summary": "Plan, draft, classify, and publish issues in the main thread",
      "claude": {
        "model": "sonnet",
        "effort": "medium"
      },
      "codex": {
        "model": "gpt-6.1-sol",
        "effort": "medium"
      }
    },
    "issue-triage": {
      "summary": "Independent read-only classification, decomposition, and dependency judgment of drafted issues, when filing needs it",
      "claude": {
        "model": "haiku",
        "effort": "low"
      },
      "codex": {
        "model": "gpt-6-luna",
        "effort": "low"
      }
    },
    "implementation": {
      "summary": "Delegated leaf delivery and PR rework through ready-for-review PRs; advisory only for explicit inline delivery",
      "claude": {
        "model": "claude-opus-5-5",
        "effort": "medium"
      },
      "codex": {
        "model": "gpt-6.1-sol",
        "effort": "medium"
      }
    },
    "code-review": {
      "summary": "Read-only review against acceptance criteria and exact SHAs",
      "claude": {
        "model": "opus",
        "effort": "high"
      },
      "codex": {
        "model": "gpt-6.1-sol",
        "effort": "high"
      }
    },
    "security-review": {
      "summary": "Explicitly requested read-only security review",
      "claude": {
        "model": "opus",
        "effort": "max"
      },
      "codex": {
        "model": "gpt-6-astra",
        "effort": "high"
      }
    }
  },
  "roles": {
    "issue-triager": "issue-triage",
    "implementer": "implementation",
    "code-reviewer": "code-review",
    "security-reviewer": "security-review"
  },
  "supported": {
    "claude": {
      "description": "Model aliases accepted by the Agent tool and subagent frontmatter, with the effort levels each supports. Full IDs matching modelIdPattern are accepted with the same effort levels.",
      "modelIdPattern": "^claude-[a-z0-9-]+$",
      "models": {
        "haiku": ["low", "medium", "high", "xhigh", "max"],
        "sonnet": ["low", "medium", "high", "xhigh", "max"],
        "opus": ["low", "medium", "high", "xhigh", "max"],
        "fable": ["low", "medium", "high", "xhigh", "max"]
      }
    },
    "codex": {
      "description": "Model slugs accepted by spawn_agent, with the reasoning efforts each supports. Keep this in step with the Codex model catalog (`codex debug models`).",
      "models": {
        "gpt-6.1-sol": ["low", "medium", "high", "xhigh", "max", "ultra"],
        "gpt-6-sol": ["low", "medium", "high", "xhigh", "max", "ultra"],
        "gpt-6-astra": ["low", "medium", "high", "xhigh", "max", "ultra"],
        "gpt-6-luna": ["low", "medium", "high", "xhigh", "max"],
        "gpt-5.6-sol": ["low", "medium", "high", "xhigh", "max", "ultra"],
        "gpt-5.6-terra": ["low", "medium", "high", "xhigh", "max", "ultra"],
        "gpt-5.6-luna": ["low", "medium", "high", "xhigh", "max"]
      }
    }
  },
  "implementationEffort": {
    "default": "medium",
    "automaticMaximum": "high",
    "maximumTransitions": 1,
    "assessmentOrder": [
      "Reuse ticket/spec decisions",
      "Name a concrete unresolved correctness question",
      "Inspect only relevant evidence when needed",
      "Try an existing pattern, focused test, or smaller reviewable step",
      "Apply a rule only with evidence and why medium with the written plan is insufficient"
    ],
    "blockers": [
      "missing acceptance criteria",
      "missing product decisions",
      "missing credentials",
      "unmet prerequisites",
      "missing reproducible evidence"
    ],
    "nonTriggers": [
      "labels",
      "severity",
      "risk",
      "area",
      "infrastructure",
      "shared packages",
      "Size L",
      "file count",
      "multiple consumers",
      "unfamiliar code",
      "routine failures",
      "review round count"
    ],
    "rules": {
      "H1-boundary": {
        "description": "Design or prove a new security, immutable-evidence, persistent-data, or compatibility guarantee across components. The ticket/spec leaves the mechanism unresolved. Applying an established specified pattern does not qualify.",
        "requires": [
          "newGuarantee",
          "acrossComponents",
          "mechanismUnresolved",
          "failureScenario"
        ]
      },
      "H2-coupled-design": {
        "description": "An algorithm, state machine, concurrency protocol, or migration has interacting correctness constraints unresolved by the supplied design. File count, Size L, and multiple consumers do not qualify.",
        "requires": [
          "interactingConstraints",
          "designUnresolved",
          "patternsInsufficient",
          "testsInsufficient",
          "decompositionInsufficient"
        ]
      },
      "H3-demonstrated-limit": {
        "description": "A medium attempt produced a reproducible correctness failure or substantive review finding requiring an underlying design revision. Routine test, formatting, environment failures, first unsuccessful attempts, and review counts do not qualify. Retry and two-round review limits still apply.",
        "requires": [
          "mediumAttempt",
          "reproducibleFailureOrFinding",
          "designRevisionRequired",
          "unresolvedReasoning"
        ]
      }
    }
  },
  "workflowLint": {
    "areas": {
      "ci": "CI",
      "release": "Release",
      "tracker": "Tracker"
    },
    "pullRequestTarget": [
      "tracker-pr-issue-status.yml",
      "tracker-pr-metadata.yml"
    ],
    "requiredChecks": [
      {
        "file": "ci-checks.yml",
        "job": "run-checks",
        "name": "Run format, lint, typecheck, and tests"
      },
      {
        "file": "ci-pr-title.yml",
        "job": "check-pr-title",
        "name": "Check PR title follows Conventional Commits"
      },
      {
        "file": "ci-secret-scan.yml",
        "job": "scan-secrets",
        "name": "Scan commits for secrets"
      }
    ]
  }
}
